{
  "schema_version": "1.0.0",
  "as_of": "2026-08-30",
  "mapping_count": 31,
  "mappings": [
    {
      "id": "F-01",
      "implementation_status": "SEEDED",
      "profiles": ["proving_ground"],
      "source_paths": ["docs/security-program/registry/scenarios.json", "docs/security-program/registry/schema/scenario.schema.json", "scripts/security-program/validate-registry.mjs", "scripts/security-program/generate-views.mjs"],
      "scenarios_served": [],
      "evidence_state": "MODELLED",
      "release_status": "FOUNDATION",
      "permission_privacy": "Documentation and build-time validation only; no runtime permission or data change.",
      "failure_mode": "Validation and generation fail closed on schema, dependency, count, safety, or drift errors.",
      "known_limitation": "The supplied upstream capability/schema/backlog JSON was absent; this registry is reconstructed from the supplied master document and locally revalidated.",
      "issue_refs": ["#449"],
      "pr_refs": []
    },
    {
      "id": "F-02",
      "implementation_status": "PARTIAL",
      "profiles": ["proving_ground"],
      "source_paths": ["scripts/fetch-phishing-corpus.mjs", "tests/corpus/README.md", "tests/e2e/proving_ground_fake_sink.ts", "tests/proving-ground-fake-sink.test.ts", "tests/e2e/proving-ground-overlay-sink.spec.ts", "tests/e2e/clipboard-timebomb.spec.ts"],
      "scenarios_served": ["CRED", "FLOW", "SUPPLY", "NS-ADV-UI-004", "NS-ADV-CLIP-005"],
      "evidence_state": "FIXTURE_PROVEN",
      "release_status": "FOUNDATION",
      "permission_privacy": "The typed UI sink binds to loopback, can enforce run-scoped one-use target authorities, accepts only synthetic sentinels, stores only their digest, and fails on unexpected egress.",
      "failure_mode": "Unexpected egress, an unarmed or exhausted target, or non-sentinel input makes the run TEST_INVALID.",
      "known_limitation": "Typed wrong-target UI and inert shell-paste consequences now exist; CLIP-005 remains MODELLED because its runner does not bind exact repository, build, fixture, and cleanliness provenance. There is no general reserved-origin router, profile reset service, fake download target, or native execution sink.",
      "issue_refs": ["#417", "#439", "#449"],
      "pr_refs": ["#598", "#605"]
    },
    {
      "id": "F-03",
      "implementation_status": "PARTIAL",
      "profiles": ["proving_ground"],
      "source_paths": ["playwright.config.ts", "tests/e2e/extension_test_utils.ts", "tests/e2e/playwright-topology.ts", "tests/e2e/proving-ground-overlay-sink.spec.ts", "tests/e2e/evasion-locality-evidence.spec.ts", "tests/e2e/clipboard-timebomb.spec.ts"],
      "scenarios_served": ["EVADE", "SELF", "STATE", "NS-ADV-UI-004", "NS-ADV-CLIP-005"],
      "evidence_state": "REGRESSION_PROVEN",
      "release_status": "FOUNDATION",
      "permission_privacy": "The UI-004, evasion-locality, and CLIP-005 lanes use disposable persistent profiles, trusted Playwright input, typed loopback sinks, and a loopback-only request fence; loading or reloading owner Chrome remains owner-owned.",
      "failure_mode": "Missing readiness or untrusted input makes a run TEST_INVALID; a lane that cannot reject stale artifacts stays UNVERIFIED and may not advance beyond MODELLED.",
      "known_limitation": "The bounded lanes use Playwright-bundled Chromium. Evasion covers one representative composite journey; CLIP-005 covers one deterministic attack delay, one matched benign delayed write, and a browser-only paste sink, but remains MODELLED because exact build and fixture provenance is not bound. Neither is mutation-robust, and #420/#439 still do not establish an operational branded-Chrome Gate-3 lane.",
      "issue_refs": ["#420", "#439", "#449", "#460", "#498", "#565"],
      "pr_refs": ["#598", "#605"]
    },
    {
      "id": "F-04",
      "implementation_status": "PARTIAL",
      "profiles": ["proving_ground"],
      "source_paths": ["tests/corpus/corpus_scoring.ts", "tests/corpus/corpus_scoring.test.ts", "tests/e2e/overlay-cleanup-nesting.spec.ts", "tests/e2e/proving_ground_fake_sink.ts", "tests/e2e/proving-ground-overlay-sink.spec.ts", "tests/e2e/evasion-locality-evidence.spec.ts", "tests/e2e/clipboard-timebomb.spec.ts"],
      "scenarios_served": ["NAV", "UI", "CRED", "CLIP", "NS-ADV-UI-004", "NS-ADV-CLIP-005"],
      "evidence_state": "REGRESSION_PROVEN",
      "release_status": "FOUNDATION",
      "permission_privacy": "Oracles must store outcome metadata rather than secrets or page content.",
      "failure_mode": "A product event without independent harm fields cannot advance evidence.",
      "known_limitation": "Independent receipts cover UI-004 and one representative evasion journey. CLIP-005 has an inert browser-only paste consequence receipt but remains MODELLED because its diagnostic output is not bound to exact build and fixture provenance; the other eleven evasion fixtures, RW journeys, native paste destinations, and other consequence types do not yet use one.",
      "issue_refs": ["#417", "#449"],
      "pr_refs": ["#598", "#605"]
    },
    {
      "id": "F-05",
      "implementation_status": "PARTIAL",
      "profiles": ["proving_ground"],
      "source_paths": ["gym/evasion-05-composite.html", "gym/local-fixture-targets.js", "gym/local-fixture-sink.html", "tests/e2e/evasion.spec.ts", "tests/e2e/evasion-locality-evidence.spec.ts", "tests/scoring.property.test.ts"],
      "scenarios_served": ["UI", "RUNTIME", "EVADE"],
      "evidence_state": "MODELLED",
      "release_status": "FOUNDATION",
      "permission_privacy": "Generated variants must remain inert, local, deterministic, and free of production-visible test markers.",
      "failure_mode": "Semantically invalid mutations are TEST_INVALID and never counted as security passes or misses.",
      "known_limitation": "All twelve authored evasion fixtures now use a shared local-target contract, but only the composite representative has an independent sink receipt; there is no deterministic invariant-preserving mutation engine or survivor registry.",
      "issue_refs": ["#449"],
      "pr_refs": ["#605"]
    },
    {
      "id": "F-06",
      "implementation_status": "PARTIAL",
      "profiles": ["proving_ground"],
      "source_paths": ["gym/level7-legit-modal-backdrop.html", "gym/level8-legit-oauth-popup.html", "gym/level9-legit-video-overlay.html", "gym/clickfix-05-delayed-rewrite.html", "tests/e2e/navsentinel.spec.ts", "tests/e2e/clipboard-timebomb.spec.ts"],
      "scenarios_served": ["UI", "AUTH", "WIN", "MONEY", "CLIP", "NS-ADV-CLIP-005"],
      "evidence_state": "MODELLED",
      "release_status": "FOUNDATION",
      "permission_privacy": "Benign and mixed journeys use synthetic data and local origins.",
      "failure_mode": "A scenario without the closest benign control and mixed journey remains MODELLED at most.",
      "known_limitation": "Benign fixtures exist, but coverage is not paired systematically with all 168 scenario seeds.",
      "issue_refs": ["#232", "#417"],
      "pr_refs": []
    },
    {
      "id": "F-07",
      "implementation_status": "PARTIAL",
      "profiles": ["proving_ground"],
      "source_paths": ["playwright.stress.config.ts", "tests/e2e/navsentinel.stress.spec.ts", "tests/session-state.test.ts", "tests/sw-rollback.test.ts"],
      "scenarios_served": ["STATE", "WIN", "AUTH"],
      "evidence_state": "MODELLED",
      "release_status": "FOUNDATION",
      "permission_privacy": "State traces must be bounded and context-owned.",
      "failure_mode": "Stale or cross-context authority is a product failure; an unproved disturbance is HARNESS_INVALID.",
      "known_limitation": "Stress coverage exercises selected restarts and churn, not BFCache, discard, update, permission revoke, or all bridge-loss generations.",
      "issue_refs": ["#175", "#186", "#389", "#460"],
      "pr_refs": []
    },
    {
      "id": "F-08",
      "implementation_status": "NOT_IMPLEMENTED",
      "profiles": ["proving_ground"],
      "source_paths": ["tests/corpus/README.md"],
      "scenarios_served": ["CRED", "IDN", "SUPPLY"],
      "evidence_state": "UNMODELLED",
      "release_status": "FOUNDATION",
      "permission_privacy": "Holdout inputs must remain separated from implementation and contain no live secrets or active targets.",
      "failure_mode": "Partition contamination invalidates the affected efficacy result.",
      "known_limitation": "No committed train/tune/holdout manifest or contamination check exists.",
      "issue_refs": ["#417", "#449"],
      "pr_refs": []
    },
    {
      "id": "F-09",
      "implementation_status": "PARTIAL",
      "profiles": ["proving_ground"],
      "source_paths": ["tests/corpus/results/validation-2026-05-01.md", "docs/agentic/FAILURE_LEDGER.md", "ACTION_ITEMS.md"],
      "scenarios_served": ["SELF", "STATE", "EVADE"],
      "evidence_state": "MODELLED",
      "release_status": "FOUNDATION",
      "permission_privacy": "Receipts are redacted, local, bounded, and exclude raw secrets and default page content.",
      "failure_mode": "Missing exact build, browser, oracle, or limitation prevents evidence promotion.",
      "known_limitation": "Evidence is distributed across tests and prose; no scenario-keyed receipt ledger currently exists.",
      "issue_refs": ["#416", "#417", "#439", "#449", "#591"],
      "pr_refs": []
    },
    {
      "id": "F-10",
      "implementation_status": "PARTIAL",
      "profiles": ["proving_ground"],
      "source_paths": ["scripts/benchmark.mjs", "scripts/benchmark-baseline.json"],
      "scenarios_served": ["NAV", "UI", "CRED", "SOCIAL"],
      "evidence_state": "UNMODELLED",
      "release_status": "POST_BETA",
      "permission_privacy": "Comparators require pinned configuration and no uncontrolled fixture traffic.",
      "failure_mode": "Comparator or configuration failure is reported separately from product efficacy.",